
  {
    "heading": "Rebuilt - 2026 (Pit Scouting)",
    "logo": "logo.png",
    "skipTeamSelection": true,
    "pages": [
      {
        "name": "Team",
        "widgets": [
          {
            "name": "Team Name",
            "type": "text"
          },
          {
            "name": "Team Number",
            "type": "number"
          }
        ]
      },
      {
        "name": "Robot",
        "widgets": [
          {
            "name": "Height",
            "type": "number"
          },
          {
            "name": "Length",
            "type": "number"
          },
          {
            "name": "Width",
            "type": "number"
          },
          {
            "name": "Number of Batteries",
            "type": "number"
          },
          {
            "name": "Weight",
            "type": "number"
          },
          {
            "name": "Drivetrain",
            "type": "dropdown",
            "options": [
              "West Coast",
              "Swerve",
              "Butterfly",
              "Mecanum",
              "Other"
            ]
          },
          {
            "name": "Swerve Motor Type",
            "type": "dropdown",
            "options": [
              "Neo",
              "Falcon",
              "Cim",
              "Kraken"
            ]
          },
          {
            "name": "Swerve Type",
            "type": "dropdown",
            "options": [
              "No swerve",
              "Mk 4",
              "Mk 4i",
              "Custom"
            ]
          }
        ]
      },
      {
        "name": "Match Play",
        "widgets": [
          {
            "name": "Crossing",
            "type": "multicheckbox",
            "options": [
              "Trench",
              "Bump"
            ]
          },
          {
            "name": "Hopper Size",
            "type": "number"
            
          },
          {
            "name": "Aiming",
            "type": "multicheckbox",
            "options": [
              "Manual",
              "Auto"
            ]
          },
          {
            "name": "Balls/Second",
            "type": "number"
          },
          {
            "name": "Climb Time",
            "type": "number"
          },
          {
            "name": "Comments",
            "type": "textarea",
            "colspan": 3
          },
          {
            "name": "Signature (optional :P)",
            "type": "heading"
          },
          
          
          {
            "name": "Get their autograph here",
            "type": "label",
            "file": "demo.png"
          }
        ]
      }
    ]
  }
  
  